"Dressed_to_Kill_(1980_film)","Kate Miller (Angie Dickinson) is a sexually frustrated housewife who is in therapy with New York City psychiatrist Dr. Robert Elliott (Michael Caine). During an appointment, Kate attempts to seduce him, but Elliott rejects her advances.Kate goes to the Metropolitan Museum. In a ten-minute sequence entirely without dialogue, she has an unexpected flirtation with a mysterious stranger. Kate and the stranger ""stalk"" each other through the museum until they finally wind up outside, where Kate joins him in a taxi. They begin to have sex and continue at his apartment, unaware that Kate has left her underwear on the floor of the cab.Hours later, Kate awakens and, thoroughly satisfied with her evening, decides to discreetly leave while the man, Warren Lockman, is asleep. Kate sits at his desk to leave Warren a note and finds a document indicating that he has contracted a sexually transmitted disease. Mortified, she leaves the apartment. But in her haste, she has left her wedding ring on the stranger's nightstand, so she returns to retrieve it.The elevator doors open on the figure of a tall, blonde woman in dark sunglasses wielding a straight razor, and Kate is slashed to death in the elevator (a murder scene DePalma has called the best he has ever done).[3] A high-priced call girl, Liz Blake (Nancy Allen), happens upon the body. She catches a glimpse of the killer, therefore becoming both the prime suspect and the killer's next target.Dr. Elliott receives a bizarre answering machine message from ""Bobbi,"" a transgender patient. Bobbi taunts the psychiatrist for breaking off their therapy sessions, apparently because Elliott refuses to sign the necessary papers for Bobbi to get a sex change operation. Elliott tries to convince Dr. Levy, the patient's new doctor, that Bobbi is a danger to herself and others.A police detective, Marino (Dennis Franz), is skeptical about Liz's story, partly due to her profession, so Liz joins forces with Kate's revenge-minded son Peter to find the killer. Peter, an inventor, uses a series of homemade listening devices and time-lapse cameras to track patients leaving Elliott's office. They catch Bobbi on camera, and soon Liz is being stalked by a tall blonde figure in sunglasses. Several attempts are subsequently made on Liz's life. One, in the New York City Subway, is thwarted by Peter, who sprays Bobbi with homemade mace.Liz and Peter scheme to learn Bobbi's real name by getting inside Dr. Elliott's office to look at his appointment book. Liz baits the therapist by stripping to lingerie and coming on to him, distracting him long enough to make a brief exit and leaf through his appointment book. When she returns, it is Bobbi rather than Elliott who confronts her; they are the same person. Elliott/Bobbi is shot and wounded by a female police officer who looks like Bobbi, revealing herself to be the tall blonde figure who has been trailing Liz.Elliott is arrested by the police and placed in an insane asylum. It is explained by Dr. Levy that Elliott wanted to be a woman, but his ""male"" side would not allow him to go through with the operation. Whenever a woman sexually aroused Elliott, it was ""Bobbi,"" representing the female side of the doctor's personality, who became threatened.In a final sequence, Elliott escapes from the asylum and slashes Liz's throat in a bloody act of vengeance. She wakes up screaming, Peter by her side, realizing that it was just a dream."
"Dr._Strangelove","This article's plot summary may be too long or excessively detailed. Please help improve it by removing unnecessary details and making it more concise. (October 2013)United States Air Force Brigadier General Jack D. Ripper is commander of Burpelson Air Force Base, which houses the SAC 843rd Bomb Wing equipped with B-52 bombers. The 843rd is currently on airborne alert, in flight just hours from the Soviet border.General Ripper explains to Group Captain Mandrake how he first discovered the Communist plot to pollute Americans' ""precious bodily fluids.""Ripper orders his executive officer, Group Captain Lionel Mandrake of the UK Royal Air Force, to put the base on alert, asserting that it is not a drill, and orders him to issue Wing Attack Plan R to the patrolling aircraft, including one commanded by Major T. J. ""King"" Kong. All of the aircraft commence an attack flight on Russia, and allow communications only through the CRM 114 discriminator.Mandrake discovers that no order for war has been received, and tries to stop Ripper, who locks them both in his office. Ripper tells Mandrake that he believes the Soviets have been using fluoridation of United States' water supplies to pollute the ""precious bodily fluids"" of Americans.At the Pentagon, General Buck Turgidson briefs President Merkin Muffley and several other top officers and aides about the attack in the ""War Room"". Muffley is shocked to learn that such orders could be given without his authorization, but Turgidson reminds him that Plan R – enabling a senior officer to launch a strike against the Soviets if all superiors up to the President have been killed in a first strike on Washington D.C. – allows such an action. Turgidson reports that his men are cycling through every CRM code to issue the stand-down order but this could take over two days. Muffley orders Turgidson to storm the base and seize Ripper, though Turgidson warns that Ripper may have already alerted his men to this possibility.Turgidson attempts to convince Muffley to let the attack continue, as their first strike on the Soviets would wipe out the majority of the Soviet missiles, and the few remaining would only cost a few million American lives. Muffley refuses, and instead brings Soviet ambassador Alexei de Sadeski (Peter Bull) into the War Room, despite Turgidson's protest, to get Soviet premier Dimitri Kisov on the ""Hot Line."" The President tells the Premier, who is drunk, about the situation, and suggests that the USSR fire upon the planes to stop the attack.After a heated discussion, the ambassador explains that the Soviet Union has created a doomsday device consisting of 50 buried bombs with ""Cobalt Thorium G"" set to detonate should any nuclear attack strike their country. The Soviets had conceived of this system after reading a New York Times article claiming the United States was working on such a device. The President's wheelchair-bound scientific advisor, former Nazi Dr. Strangelove, is skeptical, noting that a doomsday device would only be an effective deterrent if everyone knew about it. Sadeski admits they had plans to reveal its existence the following week at a Soviet party conference in honor of the Premier, ""who loves surprises.""Aircraft commander Major T. J. ""King"" Kong riding the bomb.United States Army forces arrive at Burpelson, but, as predicted, the base's troops take the troops to be Soviets in disguise and open fire. The Army forces eventually take over the base and Ripper shoots himself, fearing he will be tortured into revealing the recall code. Colonel ""Bat"" Guano forces his way into Ripper's office. He suspects Mandrake of being the enemy until Mandrake convinces him otherwise.Mandrake identifies Ripper's CRM code from his desk blotter doodles (""OPE,"" a variant from both ""Peace on Earth"" and ""Purity of Essence""). He contacts the President with difficulty, on a payphone, the only working method of communication, and SAC is able to contact the bombers and direct them away from Soviet air space. The War Room celebrates. However, Sadeski reports that the Soviets cannot account for one of the four planes they believed they had shot down, Major Kong's. In fact a surface to air missile had ruptured the plane's fuel tank and left ""all radio gear kaput, including the CRM-114."" President Muffley tells the Soviets the plane's target to help them find it, but due to the shortened range of the crippled aircraft Major Kong has selected a closer target, a nuclear missile complex at Kodlosk.On approaching the new target, the bomb doors will not open. Major Kong climbs on a bomb and adjusts the wiring. The doors open and the bomb releases, with Kong straddling it and riding it like a rodeo cowboy, waving his hat, as it falls.Sadeski notes that, within ten months of the activation of the doomsday device, the surface of the earth will be uninhabitable. Dr. Strangelove recommends that the President gather several hundreds of thousands of people, with a high female-to-male ratio, to live in deep mineshafts in order to escape the radiation, and to then institute a breeding program to allow the United States to repopulate the surface after a hundred years have passed. Gen. Turgidson warns that the Soviets will likely do the same, and worries about a ""mineshaft gap.""Dr. Strangelove shouts that he has a plan, gets up from his wheelchair, takes a few halting steps and shouts, ""Mein Führer! I can walk!"" The film finally cuts to a montage of nuclear detonations, accompanied by Vera Lynn's recording of ""We'll Meet Again."""
"Dr._Strangelove","United States Air Force Brigadier General Jack D. Ripper is commander of Burpelson Air Force Base, which houses the SAC 843rd Bomb Wing equipped with B-52 bombers. The 843rd is currently on airborne alert, in flight just hours from the Soviet border.General Ripper explains to Group Captain Mandrake how he first discovered the Communist plot to pollute Americans' ""precious bodily fluids.""Ripper orders his executive officer, Group Captain Lionel Mandrake of the UK Royal Air Force, to put the base on alert, asserting that it is not a drill, and orders him to issue Wing Attack Plan R to the patrolling aircraft, including one commanded by Major T. J. ""King"" Kong. All of the aircraft commence an attack flight on Russia, and allow communications only through the CRM 114 discriminator.Mandrake discovers that no order for war has been received, and tries to stop Ripper, who locks them both in his office. Ripper tells Mandrake that he believes the Soviets have been using fluoridation of United States' water supplies to pollute the ""precious bodily fluids"" of Americans.At the Pentagon, General Buck Turgidson briefs President Merkin Muffley and several other top officers and aides about the attack in the ""War Room"". Muffley is shocked to learn that such orders could be given without his authorization, but Turgidson reminds him that Plan R ‚Ä? enabling a senior officer to launch a strike against the Soviets if all superiors up to the President have been killed in a first strike on Washington D.C. ‚Ä? allows such an action. Turgidson reports that his men are cycling through every CRM code to issue the stand-down order but this could take over two days. Muffley orders Turgidson to storm the base and seize Ripper, though Turgidson warns that Ripper may have already alerted his men to this possibility.Turgidson attempts to convince Muffley to let the attack continue, as their first strike on the Soviets would wipe out the majority of the Soviet missiles, and the few remaining would only cost a few million American lives. Muffley refuses, and instead brings Soviet ambassador Alexei de Sadeski (Peter Bull) into the War Room, despite Turgidson's protest, to get Soviet premier Dimitri Kisov on the ""Hot Line."" The President tells the Premier, who is drunk, about the situation, and suggests that the USSR fire upon the planes to stop the attack.After a heated discussion, the ambassador explains that the Soviet Union has created a doomsday device consisting of 50 buried bombs with ""Cobalt Thorium G"" set to detonate should any nuclear attack strike their country. The Soviets had conceived of this system after reading a New York Times article claiming the United States was working on such a device. The President's wheelchair-bound scientific advisor, former Nazi Dr. Strangelove, is skeptical, noting that a doomsday device would only be an effective deterrent if everyone knew about it. Sadeski admits they had plans to reveal its existence the following week at a Soviet party conference in honor of the Premier, ""who loves surprises.""Aircraft commander Major T. J. ""King"" Kong riding the bomb.United States Army forces arrive at Burpelson, but, as predicted, the base's troops take the troops to be Soviets in disguise and open fire. The Army forces eventually take over the base and Ripper shoots himself, fearing he will be tortured into revealing the recall code. Colonel ""Bat"" Guano forces his way into Ripper's office. He suspects Mandrake of being the enemy until Mandrake convinces him otherwise.Mandrake identifies Ripper's CRM code from his desk blotter doodles (""OPE,"" a variant from both ""Peace on Earth"" and ""Purity of Essence""). He contacts the President with difficulty, on a payphone, the only working method of communication, and SAC is able to contact the bombers and direct them away from Soviet air space. The War Room celebrates. However, Sadeski reports that the Soviets cannot account for one of the four planes they believed they had shot down, Major Kong's. In fact a surface to air missile had ruptured the plane's fuel tank and left ""all radio gear kaput, including the CRM-114."" President Muffley tells the Soviets the plane's target to help them find it, but due to the shortened range of the crippled aircraft Major Kong has selected a closer target, a nuclear missile complex at Kodlosk.On approaching the new target, the bomb doors will not open. Major Kong climbs on a bomb and adjusts the wiring. The doors open and the bomb releases, with Kong straddling it and riding it like a rodeo cowboy, waving his hat, as it falls.Sadeski notes that, within ten months of the activation of the doomsday device, the surface of the earth will be uninhabitable. Dr. Strangelove recommends that the President gather several hundreds of thousands of people, with a high female-to-male ratio, to live in deep mineshafts in order to escape the radiation, and to then institute a breeding program to allow the United States to repopulate the surface after a hundred years have passed. Gen. Turgidson warns that the Soviets will likely do the same, and worries about a ""mineshaft gap.""Dr. Strangelove shouts that he has a plan, gets up from his wheelchair, takes a few halting steps and shouts, ""Mein F??hrer! I can walk!"" The film finally cuts to a montage of nuclear detonations, accompanied by Vera Lynn's recording of ""We'll Meet Again."""
"Das_Boot","The story is told from the viewpoint of Lt. Werner (Herbert Grönemeyer), who has been assigned as a war correspondent on the German submarine U-96 in October 1941. He meets its captain (Jürgen Prochnow), chief engineer (Klaus Wennemann), and the crew in a French nightclub. Thomsen (Otto Sander), another captain, gives a crude drunken speech to celebrate his Ritterkreuz award, in which he openly mocks Winston Churchill and implicitly Adolf Hitler.The next morning, they sail out of the harbour of La Rochelle to a cheering crowd and playing band. Werner is given a tour of the boat. As time passes, he observes ideological differences between the new crew members and the hardened veterans, particularly the captain, who is embittered and cynical about the war. The new men, including Werner, are often mocked by the rest of the crew, who share a tight bond. After days of boredom, the crew is excited by another U-boat's spotting of an enemy convoy. They soon locate a British destroyer, but are bombarded with depth charges. They narrowly escape with only light damage.The next three weeks are spent enduring a relentless storm. Morale drops after what seems like an endless series of misfortunes, but the crew is cheered temporarily by a chance encounter with Thomsen's boat. Shortly after the storm ends, the boat encounters a British convoy and quickly launches four torpedoes, sinking two ships. However, they are spotted by a destroyer and have to dive below the submarine's rated limit. During the ensuing depth-charge attack, the chief mechanic, Johann, panics and has to be restrained. The boat sustains heavy damage, but is eventually able to safely surface in darkness. An enemy tanker remains afloat and on fire, so they torpedo the ship, only to realize that there are still sailors aboard; they watch in horror as the sailors, some on fire, leap overboard and swim towards them. Following orders not to take prisoners, the captain gives the command to back the ship away.U-boat pens at the harbor of La Rochelle (2007)46°9?32?N 1°12?33?W? / ?46.15889°N 1.20917°W? / 46.15889; -1.20917The worn-out U-boat crew looks forward to returning home to La Rochelle in time for Christmas, but the ship is ordered to La Spezia, Italy, which means passing through the Strait of Gibraltar—an area heavily defended by the Royal Navy. The U-boat makes a secret night rendezvous at the harbour of Vigo, in neutral although Axis-friendly Spain, with the SS Weser, an interned German merchant ship that clandestinely provides U-boats with fuel, torpedoes, and other supplies. The filthy officers seem out of place on the opulent luxury liner, but are warmly greeted by enthusiastic officers eager to hear their exploits. The captain learns from an envoy of the German consulate that his request for Werner and the chief engineer to be sent back to Germany has been denied.The crew finishes resupplying and departs for Italy. As they carefully approach Gibraltar and are just about to dive, they are suddenly attacked by a British fighter plane, wounding the navigator. The captain orders the boat directly south towards the African coast at full speed. British ships begin closing in and they are forced to dive; it is later implied that the ships used HF/DF (high-frequency direction finding) to locate the sub. When attempting to level off, the boat does not respond and continues to sink until, just before being crushed by the pressure, it lands on a sea shelf, at the staggering depth of 280 metres. The crew works desperately to make numerous repairs before running out of oxygen. After over 16 hours, they are miraculously able to surface by blowing out their ballast of water, and limp back to La Rochelle under the cover of darkness.The crew is pale and weary upon reaching the alternative harbour of La Rochelle on Christmas Eve. Shortly after the wounded navigator is taken ashore to a waiting ambulance, Allied planes bomb and strafe the facilities, wounding or killing most of the men. Ullmann, Johann and the 2nd Watch Officer are killed. Frenssen, Bootsmann Lamprecht and Hinrich are badly wounded. After the raid, Werner leaves the U-boat bunker in which he had taken shelter and finds the captain, with multiple bullet wounds and bleeding from the mouth, watching the U-boat sink at the dock. The captain collapses after the boat disappears under the water. Werner runs to the captain's body, recoils, and quickly glances around at the destruction, his face frozen with horror."
"Das_Boot","The story is told from the viewpoint of Lt. Werner (Herbert Gr??nemeyer), who has been assigned as a war correspondent on the German submarine U-96 in October 1941. He meets its captain (J??rgen Prochnow), chief engineer (Klaus Wennemann), and the crew in a French nightclub. Thomsen (Otto Sander), another captain, gives a crude drunken speech to celebrate his Ritterkreuz award, in which he openly mocks Winston Churchill and implicitly Adolf Hitler.The next morning, they sail out of the harbour of La Rochelle to a cheering crowd and playing band. Werner is given a tour of the boat. As time passes, he observes ideological differences between the new crew members and the hardened veterans, particularly the captain, who is embittered and cynical about the war. The new men, including Werner, are often mocked by the rest of the crew, who share a tight bond. After days of boredom, the crew is excited by another U-boat's spotting of an enemy convoy. They soon locate a British destroyer, but are bombarded with depth charges. They narrowly escape with only light damage.The next three weeks are spent enduring a relentless storm. Morale drops after what seems like an endless series of misfortunes, but the crew is cheered temporarily by a chance encounter with Thomsen's boat. Shortly after the storm ends, the boat encounters a British convoy and quickly launches four torpedoes, sinking two ships. However, they are spotted by a destroyer and have to dive below the submarine's rated limit. During the ensuing depth-charge attack, the chief mechanic, Johann, panics and has to be restrained. The boat sustains heavy damage, but is eventually able to safely surface in darkness. An enemy tanker remains afloat and on fire, so they torpedo the ship, only to realize that there are still sailors aboard; they watch in horror as the sailors, some on fire, leap overboard and swim towards them. Following orders not to take prisoners, the captain gives the command to back the ship away.U-boat pens at the harbor of La Rochelle (2007)46¬?9‚Ä?32‚Ä?N 1¬?12‚Ä?33‚Ä?WÔ?? / Ô??46.15889¬?N 1.20917¬?WÔ?? / 46.15889; -1.20917The worn-out U-boat crew looks forward to returning home to La Rochelle in time for Christmas, but the ship is ordered to La Spezia, Italy, which means passing through the Strait of Gibraltar‚Äîan area heavily defended by the Royal Navy. The U-boat makes a secret night rendezvous at the harbour of Vigo, in neutral although Axis-friendly Spain, with the SS Weser, an interned German merchant ship that clandestinely provides U-boats with fuel, torpedoes, and other supplies. The filthy officers seem out of place on the opulent luxury liner, but are warmly greeted by enthusiastic officers eager to hear their exploits. The captain learns from an envoy of the German consulate that his request for Werner and the chief engineer to be sent back to Germany has been denied.The crew finishes resupplying and departs for Italy. As they carefully approach Gibraltar and are just about to dive, they are suddenly attacked by a British fighter plane, wounding the navigator. The captain orders the boat directly south towards the African coast at full speed. British ships begin closing in and they are forced to dive; it is later implied that the ships used HF/DF (high-frequency direction finding) to locate the sub. When attempting to level off, the boat does not respond and continues to sink until, just before being crushed by the pressure, it lands on a sea shelf, at the staggering depth of 280 metres. The crew works desperately to make numerous repairs before running out of oxygen. After over 16 hours, they are miraculously able to surface by blowing out their ballast of water, and limp back to La Rochelle under the cover of darkness.The crew is pale and weary upon reaching the alternative harbour of La Rochelle on Christmas Eve. Shortly after the wounded navigator is taken ashore to a waiting ambulance, Allied planes bomb and strafe the facilities, wounding or killing most of the men. Ullmann, Johann and the 2nd Watch Officer are killed. Frenssen, Bootsmann Lamprecht and Hinrich are badly wounded. After the raid, Werner leaves the U-boat bunker in which he had taken shelter and finds the captain, with multiple bullet wounds and bleeding from the mouth, watching the U-boat sink at the dock. The captain collapses after the boat disappears under the water. Werner runs to the captain's body, recoils, and quickly glances around at the destruction, his face frozen with horror."
