"Barry_Lyndon","Act I[edit]By What Means Redmond Barry Acquired the Style and Title of Barry LyndonAn omniscient (though unreliable[6]) narrator (voiced by Michael Hordern) informs us that in 1750s Ireland, the father of Redmond Barry (Ryan O'Neal) is killed in a duel over a disputed horse sale. The widow (Marie Kean), disdaining offers of marriage, devotes herself to her only son.As a teenager, Barry falls in love with his older cousin, Nora Brady (Gay Hamilton). Though she seduces him, she later drops Barry (who has no money) for the well-off English Captain John Quin (Leonard Rossiter). Nora and her family plan to relieve their poverty with an advantageous marriage, but Barry refuses to accept the situation and shoots Quin in a duel.Barry flees to Dublin, but en route is robbed of purse and equipment by Captain Feeney (Arthur O'Sullivan), a famous highwayman. Broke, Barry joins the British army, whereupon he reunites with Captain Grogan (Godfrey Quigley), a family friend, who informs him that, in fact, he did not kill Quin — Barry's dueling pistol was loaded with tow. The duel was staged by Nora's family to get rid of Barry so that their family finances would be secured through the marriage of Nora and Quin.Barry's regiment is sent to Germany to fight in the Seven Years' War, where Captain Grogan is fatally wounded by the French in a skirmish at the Battle of Minden. Barry deserts the army, stealing an officer courier's uniform, horse, and identification papers. En route to neutral Holland he encounters the Prussian Captain Potzdorf (Hardy Krüger), who, seeing through his disguise, offers him the choice of being turned back over to the British where he will be shot as a deserter, or enlisting in the Prussian army. Barry enlists in his second army and later receives a special commendation from Frederick the Great for saving Potzdorf's life in a battle.After the war ends in 1763, Barry is employed by Captain Potzdorf's uncle in the Prussian Ministry of Police to become the servant of the Chevalier de Balibari (Patrick Magee), a professional gambler. The Prussians suspect he is a spy and send Barry as an undercover agent to verify this. Barry reveals himself to the Chevalier right away and they become confederates cheating at cards.After he and the Chevalier cheat the Prince of Tübingen at the cardtable, the Prince accuses the Chevalier (without proof) and refuses to pay his debt unless the Chevalier demands satisfaction. When Barry relays this to his Prussian handlers, they (still suspecting that the Chevalier is a spy) are wary of allowing another meeting between the Chevalier and the Prince. So, the Prussians arrange for the Chevalier to be expelled from the country. Barry conveys this plan to the Chevalier, who flees in the night. The next morning, Barry, under disguise as the Chevalier, is escorted from Prussian territory by Prussian officers.For the next few years, Barry and the Chevalier travel the spas and parlors of Europe, profiting from their gambling with Barry enforcing reluctant debtors with a duel. Seeing that his life is going nowhere, Barry decides to marry into wealth. At a gambling table in Belgium, he encounters the beautiful and wealthy Countess of Lyndon (Marisa Berenson). He seduces and later marries her after the death of her elderly husband, Sir Charles Lyndon (Frank Middlemass).IntermissionAct II[edit]Containing an Account of the Misfortunes and Disasters Which Befell Barry LyndonOn marriage (in 1773), Barry takes the Countess' last name and settles in England to enjoy her wealth, still with no money of his own. Lord Bullingdon (Dominic Savage), Lady Lyndon's 10-year-old son by Sir Charles, does not approve of the marriage and quickly comes to hate Barry, aware that Barry is merely a ""common opportunist"" and does not love his mother. The Countess bears Barry a son, Bryan Patrick, but the marriage is unhappy: Barry is openly unfaithful and enjoys spending his wife's money in self-indulgent spending sprees while keeping his wife in dull seclusion.Some years later, Barry's mother comes to live with him at the Lyndon estate. She warns her son that his position is precarious: If Lady Lyndon were to die, all her wealth would go to her first-born son Lord Bullingdon (now a young man, played by Leon Vitali), leaving Barry penniless. Barry's mother advises him to obtain a noble title to protect himself. To further this goal, he cultivates the acquaintance of the influential Lord Wendover (André Morell) and begins to expend even larger sums of money to ingratiate himself to high society. All this effort is wasted, however, during a birthday party for Lady Lyndon, where Lord Bullingdon announces his hatred of his stepfather and his intention to leave the family estate for as long as his mother remains married to Barry. Angered, Barry assaults Bullingdon before the guests. This public display of cruelty loses Barry all the powerful friends he has worked so hard to make and he is shunned socially. Bullingdon makes good on his announcement and leaves the estate and England itself for parts unknown.In contrast to his mistreatment of his stepson, Barry proves a compassionate and doting father to Bryan, with whom he spends all his time after Bullingdon's departure. He cannot refuse his son anything, and succumbs to Bryan's insistence on receiving a full-grown horse for his ninth birthday. The spoiled Bryan disobeys his parents' direct instructions that Bryan ride the horse only in the presence of his father, and is thrown by the horse. Bryan dies a few days later from his injuries.The grief-stricken Barry turns to alcohol, while Lady Lyndon seeks solace in religion, assisted by the Reverend Samuel Runt (Murray Melvin), who had been tutor first to Lord Bullingdon and then to Bryan. Left in charge of the families' affairs while Barry and Lady Lyndon grieve, Barry's mother dismisses the Reverend, both because the family no longer needs (nor can afford, due to Barry's spending debts) a tutor and for fear that his influence worsens Lady Lyndon's condition. Plunging even deeper into grief, Lady Lyndon later attempts suicide (though she ingests only enough poison to make herself ill). The Reverend and the family's accountant and emissary Graham (Philip Stone) then seek out Lord Bullingdon. Upon hearing of these events, Lord Bullingdon returns to England where he finds Barry in a local tavern getting drunk and mourning the loss of his son rather than being with Lady Lyndon. Bullingdon demands ""satisfaction"" (a challenge to a duel) for Barry's public assault.The duel with pistols is held in an abandoned chapel. A coin-toss gives Bullingdon the right of first fire, but his pistol misfires as it is being cocked. Barry, reluctant to shoot Bullingdon, magnanimously fires into the ground, but the unmoved Bullingdon refuses to let the duel end. In the second round, Bullingdon shoots Barry in his left leg. At a nearby inn, a surgeon informs Barry that the leg will need to be amputated below the knee if he is to survive.While Barry is recovering, Bullingdon takes control of the estate. He sends a very nervous Graham to the inn with a proposition: Bullingdon will grant Barry an annuity of 500 guineas per year for life on the conditions that he leave England forever and end his marriage to Lady Lyndon. Otherwise, with his credit and bank accounts exhausted, Barry's creditors and bill collectors will assuredly see that he is jailed. Defeated, Barry accepts. The narrator states that Barry goes first to Ireland with his mother, then to the European continent to resume his former profession of gambler (though without his former success) and that he never sees Lady Lyndon again. The final scene (set in December 1789) shows the middle-aged Lady Lyndon signing Barry's annuity cheque as Bullingdon looks on.Epilogue[edit]It was in the reign of George III that the aforesaid personages lived and quarreled; good or bad, handsome or ugly, rich or poor, they are all equal now."
"Barry_Lyndon","Act I[edit]By What Means Redmond Barry Acquired the Style and Title of Barry LyndonAn omniscient (though unreliable[6]) narrator (voiced by Michael Hordern) states that in 1750s Ireland, the father of Redmond Barry (Ryan O'Neal) is killed in a duel over a disputed horse sale. The widow (Marie Kean), disdaining offers of marriage, devotes herself to her only son.As a teenager, Barry falls in love with his older cousin, Nora Brady (Gay Hamilton). Though she seduces him, she later drops Barry (who has no money) for the well-off English Captain John Quin (Leonard Rossiter). Nora and her family plan to relieve their poverty with an advantageous marriage, but Barry refuses to accept the situation and shoots Quin in a duel.Barry flees to Dublin, but en route is robbed of purse and equipment by Captain Feeney (Arthur O'Sullivan), an infamous highwayman. Broke, Barry joins the British army, whereupon he reunites with Captain Grogan (Godfrey Quigley), a family friend, who informs him that, in fact, he did not kill Quin ‚Äî Barry's dueling pistol was loaded with tow. The duel was staged by Nora's family to get rid of Barry so that their family finances would be secured through the marriage of Nora and Quin.Barry's regiment is sent to Germany to fight in the Seven Years' War, where Captain Grogan is fatally wounded by the French in a skirmish at the Battle of Minden. Barry deserts the army, stealing an officer courier's uniform, horse, and identification papers. En route to neutral Holland he encounters the Prussian Captain Potzdorf (Hardy Kr??ger), who, seeing through his disguise, offers him the choice of being turned back over to the British where he will be shot as a deserter, or enlisting in the Prussian army. Barry enlists in his second army and later receives a special commendation from Frederick the Great for saving Potzdorf's life in a battle.After the war ends in 1763, Barry is employed by Captain Potzdorf's uncle in the Prussian Ministry of Police to become the servant of the Chevalier de Balibari (Patrick Magee), a professional gambler. The Prussians suspect he is a spy and send Barry as an undercover agent to verify this. Barry reveals himself to the Chevalier right away and they become confederates cheating at cards.After he and the Chevalier cheat the Prince of T??bingen at the cardtable, the Prince accuses the Chevalier (without proof) and refuses to pay his debt unless the Chevalier demands satisfaction. When Barry relays this to his Prussian handlers, they (still suspecting that the Chevalier is a spy) are wary of allowing another meeting between the Chevalier and the Prince. So, the Prussians arrange for the Chevalier to be expelled from the country. Barry conveys this plan to the Chevalier, who flees in the night. The next morning, Barry, under disguise as the Chevalier, is escorted from Prussian territory by Prussian officers.For the next few years, Barry and the Chevalier travel the spas and parlors of Europe, profiting from their gambling with Barry enforcing reluctant debtors with a duel. Seeing that his life is going nowhere, Barry decides to marry into wealth. At a gambling table in Belgium, he encounters the beautiful and wealthy Countess of Lyndon (Marisa Berenson). He seduces and later marries her after the death of her elderly husband, Sir Charles Lyndon (Frank Middlemass).IntermissionAct II[edit]Containing an Account of the Misfortunes and Disasters Which Befell Barry LyndonIn 1773, Barry takes the Countess' last name in marriage and settles in England to enjoy her wealth, still with no money of his own. Lord Bullingdon (Dominic Savage), Lady Lyndon's 10-year-old son by Sir Charles, does not approve of the marriage and quickly comes to hate Barry, aware that Barry is merely a ""common opportunist"" and does not love his mother. The Countess bears Barry a son, Bryan Patrick, but the marriage is unhappy: Barry is openly unfaithful and enjoys spending his wife's money in self-indulgent spending sprees while keeping his wife in dull seclusion.Some years later, Barry's mother comes to live with him at the Lyndon estate. She warns her son that his position is precarious: If Lady Lyndon were to die, all her wealth would go to her first-born son Lord Bullingdon (now a young man, played by Leon Vitali), leaving Barry penniless. Barry's mother advises him to obtain a noble title to protect himself. To further this goal, he cultivates the acquaintance of the influential Lord Wendover (Andr?© Morell) and begins to expend even larger sums of money to ingratiate himself to high society. All this effort is wasted, however, during a birthday party for Lady Lyndon, where Lord Bullingdon announces his hatred of his stepfather and his intention to leave the family estate for as long as his mother remains married to Barry. Angered, Barry assaults Bullingdon before the guests. This public display of cruelty loses Barry all the powerful friends he has worked so hard to make and he is shunned socially. Bullingdon makes good on his announcement and leaves the estate and England itself for parts unknown.In contrast to his mistreatment of his stepson, Barry proves a compassionate and doting father to Bryan, with whom he spends all his time after Bullingdon's departure. He cannot refuse his son anything, and succumbs to Bryan's insistence on receiving a full-grown horse for his ninth birthday. The spoiled Bryan disobeys his parents' direct instructions that Bryan ride the horse only in the presence of his father, and is thrown by the horse. Bryan dies a few days later from his injuries.The grief-stricken Barry turns to alcohol, while Lady Lyndon seeks solace in religion, assisted by the Reverend Samuel Runt (Murray Melvin), who had been tutor first to Lord Bullingdon and then to Bryan. Left in charge of the families' affairs while Barry and Lady Lyndon grieve, Barry's mother dismisses the Reverend, both because the family no longer needs (nor can afford, due to Barry's spending debts) a tutor and for fear that his influence worsens Lady Lyndon's condition. Plunging even deeper into grief, Lady Lyndon later attempts suicide (though she ingests only enough poison to make herself ill). The Reverend and the family's accountant and emissary Graham (Philip Stone) then seek out Lord Bullingdon. Upon hearing of these events, Lord Bullingdon returns to England where he finds Barry in a local tavern getting drunk and mourning the loss of his son rather than being with Lady Lyndon. Bullingdon demands ""satisfaction"" (a challenge to a duel) for Barry's public assault.The duel with pistols is held in an abandoned chapel. A coin-toss gives Bullingdon the right of first fire, but his pistol misfires as it is being cocked. Barry, reluctant to shoot Bullingdon, magnanimously fires into the ground, but the unmoved Bullingdon refuses to let the duel end. In the second round, Bullingdon shoots Barry in his left leg. At a nearby inn, a surgeon informs Barry that the leg will need to be amputated below the knee if he is to survive.While Barry is recovering, Bullingdon takes control of the estate. He sends a very nervous Graham to the inn with a proposition: Bullingdon will grant Barry an annuity of 500 guineas per year for life on the conditions that he leave England forever and end his marriage to Lady Lyndon. Otherwise, with his credit and bank accounts exhausted, Barry's creditors and bill collectors will assuredly see that he is jailed. Defeated, Barry accepts. The narrator states that Barry goes first to Ireland with his mother, then to the European continent to resume his former profession of gambler (though without his former success) and that he never sees Lady Lyndon again. In December 1789, middle-aged Lady Lyndon signs Barry's annuity cheque as Bullingdon observes.Epilogue[edit]It was in the reign of George III that the aforesaid personages lived and quarreled; good or bad, handsome or ugly, rich or poor, they are all equal now."
"Buffy_the_Vampire_Slayer_(film)","Buffy Summers (Kristy Swanson) is introduced as a stereotypical cheerleader at Hemery High School in Los Angeles. She is a carefree popular girl whose main concerns are shopping and spending time with her friends. While at school one day, she is approached by a man named Merrick Jamison-Smythe (Donald Sutherland). He informs her that she is The Slayer, or chosen one, and he is a Watcher whose duty it is to guide and train her. She initially refuses to believe his claims, but finally becomes convinced that he is right when he is able to describe a recurring dream of hers in detail. In addition, Buffy is exhibiting uncanny abilities not known to her, including heightened agility, senses, and endurance.Meanwhile Oliver Pike (Luke Perry), and best friend Benny (David Arquette), who resented Buffy and her friends due to their social circles, are out drinking when they are attacked by vampires. Benny is turned but Oliver is saved by Merrick. As a vampire, Benny visits Oliver and tries to get him to join him. When Oliver and his boss are discussing Benny, Oliver tells him to run if he sees him.After several successful outings, Buffy is drawn into conflict with a local vampire king named Lothos (Rutger Hauer), who has killed a number of past Slayers. During an encounter with Lothos' main minion Amilyn (Paul Reubens) and his gang of vampires, Buffy, Oliver and Merrick fight against them in the forest as Amilyn loses his arm. Amilyn flees the fight to talk to Lothos who now has his focus on Buffy. After this encounter, Buffy and Oliver start a friendship, which eventually becomes romantic and Oliver becomes Buffy's partner in fighting the undead.During a basketball game, Buffy and Oliver find out that one of the players is a minion of Lothos. After a quick chase to a parade float storage yard, Buffy finally confronts Lothos, shortly after she and Oliver take down his gang. Lothos catches Buffy in a hypnotic trance, which is broken due to Merrick's intervention. Lothos turns on Merrick and impales him with the stake he attempted to use on him. Lothos leaves, saying that Buffy is not ready. As Merrick dies, he tells Buffy to do things her own way, rather than live by the rules of others. Buffy becomes emotionally shocked, has a falling out with her friends and starts dropping her Slayer responsibilities.At the senior dance, Buffy meets up with Oliver and as they start to dance and eventually kiss, Lothos leads the remainder of his minions to the school and attacks the students and the attending faculty. Buffy confronts the vampires outside while Oliver fights the vampiric Benny. After overpowering the vampires, she confronts Lothos inside the school and stabs Amilyn. Lothos hypnotises Buffy again but she uses a cross and hairspray to create a makeshift flame-thrower and burns Lothos before heading back into the gym. Buffy sees everybody recover from the attack, but Lothos emerges again getting into a fight with Buffy, who then stakes him.The film ends with Buffy and Oliver leaving the prom on a motorcycle, and a news crew interviewing the students and the principal about the attack during the credits."
"Buffy_the_Vampire_Slayer_(film)","High school senior Buffy Summers (Kristy Swanson) is introduced as a stereotypical, shallow cheerleader at Hemery High School in Los Angeles. She is a carefree popular girl whose main concerns are shopping and spending time with her airhead friends. While at school one day, she is approached by a man named Merrick Jamison-Smythe (Donald Sutherland). He informs her that she is The Slayer, or chosen one, and he is a Watcher whose duty it is to guide and train her. She initially rebukes his claims, but finally becomes convinced that he is right when he is able to describe a recurring dream of hers in detail. In addition, Buffy is exhibiting uncanny abilities not known to her, including heightened agility, senses, and endurance.Meanwhile Oliver Pike (Luke Perry), and best friend Benny (David Arquette), who resented Buffy and her friends due to differing social circles, are out drinking when they are attacked by vampires. Benny is turned but Oliver is saved by Merrick. As a vampire, Benny visits Oliver and tries to get him to join him. Later, when Oliver and his boss are discussing Benny, Oliver tells him to run if he sees him.After several successful outings, Buffy is drawn into conflict with a local vampire king named Lothos (Rutger Hauer), who has killed a number of past Slayers. During an encounter with Lothos' main minion Amilyn (Paul Reubens) and his gang of vampires, Buffy, Oliver, and Merrick fight against them in the forest as Amilyn loses his arm. Amilyn flees the fight to talk to Lothos who now realizes Buffy is the slayer. After this encounter, Buffy and Oliver start a friendship, which eventually becomes romantic and Oliver becomes Buffy's partner in fighting the undead.During a basketball game, Buffy and Oliver find out that one of the players is a minion of Lothos. After a quick chase to a parade float storage yard, Buffy finally confronts Lothos, shortly after she and Oliver take down his gang. Lothos puts Buffy in a hypnotic trance, which is broken due to Merrick's intervention. Lothos turns on Merrick and impales him with the stake he attempted to use on him. Lothos leaves, saying that Buffy is not ready. As Merrick dies, he tells Buffy to do things her own way rather than live by the rules of others. Because of her new life, responsibilities, and heartbreak, Buffy becomes emotionally shocked and has a falling out with her friends as she outgrows their immature, selfish behavior, and starts dropping her Slayer responsibilities.At the senior dance, Buffy meets up with Oliver and as they start to dance and eventually kiss, Lothos leads the remainder of his minions to the school and attacks the students and the attending faculty. Buffy confronts the vampires outside while Oliver fights the vampiric Benny. After overpowering the vampires, she confronts Lothos inside the school and stabs Amilyn. Lothos hypnotises Buffy again but she uses a cross and hairspray to create a makeshift flame-thrower and burns Lothos before heading back into the gym. Buffy sees everybody recover from the attack, but Lothos emerges again getting into a fight with Buffy, who then stakes him.The film ends with Buffy and Oliver leaving the prom on a motorcycle, and a news crew interviewing the students and the principal about the attack during the credits."
